<?xml version="1.0" encoding="UTF-8"?>
<package name="com.sample" xmlns="http://drools.org/drools-5.2"
  xmlns:xs="http://www.w3.org/2001/XMLSchema-instance"
  xs:schemaLocation="http://drools.org/drools-5.2 drools.org/drools-5.2.xsd">

  <rule name="simple_rule">
    <lhs>
      <exists>
        <pattern object-type="Person">
<expr>
likes == type
</expr>
        </pattern>
      </exists>

            <not>
                <exists>
                    <pattern object-type="Cheese">
<expr>
likes == type
</expr>
                    </pattern>
                </exists>
            </not>
    </lhs>
    <rhs> list.add( $cheese ); </rhs>
  </rule>

</package>
